{
  "$schema": "https://json-schema.org/draft-07/schema#",
  "title": "VM Configuration",
  "required": [
    "vm",
    "application",
    "remote_machine"
  ],
  "type": "object",
  "properties": {
    "vm": {
      "$ref": "./vm/root.json"
    },
    "custom_demo": {
      "$ref": "./custom_demo/root.json"
    },
    "application": {
      "$ref": "./application/root.json"
    },
    "infrastructure": {
      "$ref": "./infrastructure/root.json"
    },
    "provisioner": {
      "$ref": "./provisioner/root.json"
    },
    "remote_machine": {
      "$ref": "./remote_machine/root.json"
    }
  },
  "additionalProperties": false
}