{
	"vm": {
		"name": "Luma VM",
		"hypervisor": "virtualbox"
	},
	"custom_demo": {
		"structure": {
			"websites": [
				{
					"site_code": "base",
					"site_url": "luma.demo",
					"stores": [
						{
							"store_views": [
								{
									"store_view_code": "default"
								},
								{
									"store_view_code": "custom_store_view_ca_fr",
									"store_view_url": "fr.luma.ca"
								}
							]
						},
						{
							"store_views": [
								{
									"store_view_code": "custom_store_view_us_en",
									"store_view_url": "custom.luma.demo"
								}
							]
						}
					]
				},
				{
					"site_code": "custom_b2b_website",
					"site_url": "b2b.luma.demo",
					"stores": [
						{
							"store_views": [
								{
									"store_view_code": "custom_b2b_en_us"
								}
							]
						}
					]
				}
			]
		},
		"data_packs": [],
		"custom_modules": []
	},
	"application": {
		"authentication": {
			"composer": {
				"public_key": "9aec72c4ae091290105b1624e46ba2f4",
				"private_key": "32d399998cc65508e7aa406245a21876",
				"github_token": "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"
			}
		},
		"options": {
			"version": "2.4.4"
		},
		"build": {
			"action": "force_install",
			"restore": "separate",
			"sample_data": false,
			"patches": true,
			"hooks": {
				"warm_cache": false,
				"backup": false
			}
		},
		"settings": {
			"admin_password": "admin4tls"
		}
	},
	"infrastructure": {
		"php": "8.1",
		"search_engine": "elasticsearch"
	},
	"remote_machine": {
		"cpus": "2",
		"memory": "8192"
	}
}