{
	"vm": {
		"name": "T-Mobile VM",
		"hypervisor": "virtualbox"
	},
	"custom_demo": {
		"structure": {
			"websites": [
				{
					"site_code": "base",
					"site_url": "tmobile.demo",
					"stores": [
						{
							"store_views": [
								{
									"store_view_code": "default"
								}
							]
						}
					]
				}
			]
		},
		"data_packs": [
			{
				"source": "https://github.com/skukla/module-tmo-datapack.git",
				"data": [
					{
						"data_path": "tmobile-store"
					}
				]
			}
		],
		"custom_modules": [
			{
				"source": "https://github.com/PMET-public/module-data-install.git"
			},
			{
				"source": "https://github.com/PMET-public/paradoxlabs-tokenbase.git",
				"version": "4.3.8.x-dev"
			},
			{
				"source": "https://github.com/PMET-public/paradoxlabs-subscriptions.git",
				"version": "3.3.4.x-dev"
			},
			{
				"source": "https://github.com/PMET-public/module-autofill.git"
			}
		]
	},
	"application": {
		"authentication": {
			"composer": {
				"public_key": "9aec72c4ae091290105b1624e46ba2f4",
				"private_key": "32d399998cc65508e7aa406245a21876",
				"github_token": "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"
			}
		},
		"options": {
			"version": "2.4.3-p1"
		},
		"build": {
			"action": "force_install",
			"restore": "separate",
			"sample_data": false,
			"patches": true,
			"hooks": {
				"warm_cache": false,
				"enable_media_gallery": true,
				"backup": false
			}
		},
		"settings": {
			"admin_password": "admin4tls"
		}
	},
	"infrastructure": {
		"search_engine": "elasticsearch"
	},
	"remote_machine": {
		"cpus": "2",
		"memory": "8192"
	}
}